{
  "id": 2922,
  "bookTitle": "Karlsson-on-the-Roof",
  "bookAuthors": "Astrid Lindgren",
  "publicationYear": 42768000,
  "description": "Karlsson is a very short, plump, and overconfident man who lives in a small house hidden behind a chimney on the roof",
  "telegramChatLink": "https://t.me/Sveta2607bot",
  "owner": 6393,
  "members": [
    6393
  ],
  "reviews": [],
  "created": "2026-05-11T10:47:22.640676Z",
  "modified": null
}